### ISSUE TITLE
netjack2 changing destination port while waiting for master

### ISSUE THREAD

**Issue by jreusch-barco** [jackaudio/jack2#230]
hi there
i encountered an obscure behavior of jackd2 while trying to connect to a netjack2 master.
to reproduce just configure a jackd2 to use the netjack2 backend like
` jackd -v -R -P 70 -dnet`

there should not be any master available, so it sends UDP packets to port 19000 of the appropriate multicast address:
```
#  tcpdump -n -i eth0  port 19000
16:49:32.216175 IP 172.20.51.122.19000 > 225.3.19.155.19000: UDP, length 644
16:49:33.216159 IP 172.20.51.122.19000 > 225.3.19.155.19000: UDP, length 644
[...]
```
(note, i started jackd here with the additional parameter -a 225.3.19.155 as we have another jack server running in the same subnet, but this has no influence on the bug, neither when i start it with a unicast ip address instead of a multicast)

to trigger the bug(?) now just send one UDP packet to the jackd server (here running on 172.20.51.122:19000 )
e.g. via
`$ echo -n "hello" | nc -u -q1 172.20.51.122 19000`
or
`$ echo -n "hello" >/dev/udp/172.20.51.122/19000` in a bash shell

in the tcpdump you can notice that the port, the jack daemon is sending its discovery packages now changes to the source port of this single udp packet
```
17:26:21.396190 IP 172.20.51.122.19000 > 225.3.19.153.19000: UDP, length 644
17:26:22.396199 IP 172.20.51.122.19000 > 225.3.19.153.19000: UDP, length 644
17:26:22.480137 IP 172.20.51.164.40700 > 172.20.51.122.19000: UDP, length 5 <- this here is our udp packet generated by netcat
17:26:22.480256 IP 172.20.51.122.19000 > 225.3.19.153.40700: UDP, length 644 <- destination port changed
17:26:23.480149 IP 172.20.51.122.19000 > 225.3.19.153.40700: UDP, length 644
17:26:24.480155 IP 172.20.51.122.19000 > 225.3.19.153.40700: UDP, length 644
```

this seems to come from the call to recvfrom in JackNetUnixSocket::CatchHost which passes the fSendAddr data structure.
if the master gets available we need this information for further communication, but as this is only a bogus UDP packet, it should be ignored.

one fix could be in the JackNetUnixSocket::SendTo method (and the appropriate windows pendant)
where the address part of fSendAddr gets resetted but not the port?
at least the attached patch fixes the problem for us. (the patch for the windows socket is not tested, but it seemed too similar to me :) )

thanks!
Jan

[patch_fix_port_reset.txt](https://github.com/jackaudio/jack2/files/470218/patch_fix_port_reset.txt)

**Comment by sletz** [comment]
Seems good, committed and pushed.

Stéphane

**Comment by jreusch-barco** [comment]
cool, thanks :)
